{
  "contract": "atlas-gate-event/1",
  "id": "gate-002",
  "projectId": "4f7d1c2a-8b3e-4c5d-9e6f-a1b2c3d4e5f6",
  "seq": 2,
  "stage": "capture",
  "fromStage": "capture",
  "toStage": "as-is",
  "actor": "sha256:3d0f6c1e",
  "role": "onboarding.capture.review",
  "decision": "pass",
  "reason": "Two evidence sources reviewed; scan clear.",
  "evidenceRef": "ev-001",
  "materialDigest": null,
  "createdAt": "2026-10-28T10:00:00.000Z",
  "prevHash": "54276f04c530b5df5684f53552c8cd873d9e5c9b742cec151465c20178ea9b1d",
  "hash": "3d37f8944f544694e0b4907f6f125394d266ba13f9d2b9d237f1ca470dc4bee4",
  "lane": "governed",
  "deferred": []
}
